{
  "schemaVersion": 1,
  "sourceId": "minecraft_java_local_1_21_10",
  "defaultStatus": "LOCAL_PROTOTYPE_ONLY",
  "entries": [
    { "cardId": "pf_001", "artKey": "card_art.pf_001", "sourcePath": "assets/minecraft/textures/item/bee_spawn_egg.png", "usage": "TEMPORARY_UNIT_ICON" },
    { "cardId": "pf_002", "artKey": "card_art.pf_002", "sourcePath": "assets/minecraft/textures/item/sheep_spawn_egg.png", "usage": "TEMPORARY_UNIT_ICON" },
    { "cardId": "pf_003", "artKey": "card_art.pf_003", "sourcePath": "assets/minecraft/textures/item/wolf_spawn_egg.png", "usage": "TEMPORARY_UNIT_ICON" },
    { "cardId": "pf_004", "artKey": "card_art.pf_004", "sourcePath": "assets/minecraft/textures/item/villager_spawn_egg.png", "usage": "TEMPORARY_UNIT_ICON" },
    { "cardId": "pf_005", "artKey": "card_art.pf_005", "sourcePath": "assets/minecraft/textures/block/oak_sapling.png", "usage": "TEMPORARY_BLOCK_MOTIF" },
    { "cardId": "pf_006", "artKey": "card_art.pf_006", "sourcePath": "assets/minecraft/textures/item/wheat.png", "usage": "TEMPORARY_ITEM_ICON" },
    { "cardId": "pf_007", "artKey": "card_art.pf_007", "sourcePath": "assets/minecraft/textures/block/oak_leaves.png", "usage": "TEMPORARY_BLOCK_MOTIF" },
    { "cardId": "pf_008", "artKey": "card_art.pf_008", "sourcePath": "assets/minecraft/textures/item/iron_golem_spawn_egg.png", "usage": "TEMPORARY_UNIT_ICON" },

    { "cardId": "db_001", "artKey": "card_art.db_001", "sourcePath": "assets/minecraft/textures/item/husk_spawn_egg.png", "usage": "TEMPORARY_UNIT_ICON" },
    { "cardId": "db_002", "artKey": "card_art.db_002", "sourcePath": "assets/minecraft/textures/block/suspicious_sand_0.png", "usage": "TEMPORARY_BLOCK_MOTIF" },
    { "cardId": "db_003", "artKey": "card_art.db_003", "sourcePath": "assets/minecraft/textures/item/brush.png", "usage": "TEMPORARY_ITEM_ICON" },
    { "cardId": "db_004", "artKey": "card_art.db_004", "sourcePath": "assets/minecraft/textures/block/cactus_side.png", "usage": "TEMPORARY_BLOCK_MOTIF" },
    { "cardId": "db_005", "artKey": "card_art.db_005", "sourcePath": "assets/minecraft/textures/item/pillager_spawn_egg.png", "usage": "TEMPORARY_UNIT_ICON" },
    { "cardId": "db_006", "artKey": "card_art.db_006", "sourcePath": "assets/minecraft/textures/block/sand.png", "usage": "TEMPORARY_BLOCK_MOTIF" },
    { "cardId": "db_007", "artKey": "card_art.db_007", "sourcePath": "assets/minecraft/textures/block/chiseled_sandstone.png", "usage": "TEMPORARY_BLOCK_MOTIF" },
    { "cardId": "db_008", "artKey": "card_art.db_008", "sourcePath": "assets/minecraft/textures/item/camel_spawn_egg.png", "usage": "TEMPORARY_UNIT_ICON" },

    { "cardId": "si_001", "artKey": "card_art.si_001", "sourcePath": "assets/minecraft/textures/item/snowball.png", "usage": "TEMPORARY_ITEM_ICON" },
    { "cardId": "si_002", "artKey": "card_art.si_002", "sourcePath": "assets/minecraft/textures/item/snow_golem_spawn_egg.png", "usage": "TEMPORARY_UNIT_ICON" },
    { "cardId": "si_003", "artKey": "card_art.si_003", "sourcePath": "assets/minecraft/textures/item/stray_spawn_egg.png", "usage": "TEMPORARY_UNIT_ICON" },
    { "cardId": "si_004", "artKey": "card_art.si_004", "sourcePath": "assets/minecraft/textures/item/goat_spawn_egg.png", "usage": "TEMPORARY_UNIT_ICON" },
    { "cardId": "si_005", "artKey": "card_art.si_005", "sourcePath": "assets/minecraft/textures/item/polar_bear_spawn_egg.png", "usage": "TEMPORARY_UNIT_ICON" },
    { "cardId": "si_006", "artKey": "card_art.si_006", "sourcePath": "assets/minecraft/textures/item/powder_snow_bucket.png", "usage": "TEMPORARY_ITEM_ICON" },
    { "cardId": "si_007", "artKey": "card_art.si_007", "sourcePath": "assets/minecraft/textures/block/snow.png", "usage": "TEMPORARY_BLOCK_MOTIF" },
    { "cardId": "si_008", "artKey": "card_art.si_008", "sourcePath": "assets/minecraft/textures/block/packed_ice.png", "usage": "TEMPORARY_BLOCK_MOTIF" },

    { "cardId": "cd_001", "artKey": "card_art.cd_001", "sourcePath": "assets/minecraft/textures/item/bat_spawn_egg.png", "usage": "TEMPORARY_UNIT_ICON" },
    { "cardId": "cd_002", "artKey": "card_art.cd_002", "sourcePath": "assets/minecraft/textures/item/cave_spider_spawn_egg.png", "usage": "TEMPORARY_UNIT_ICON" },
    { "cardId": "cd_003", "artKey": "card_art.cd_003", "sourcePath": "assets/minecraft/textures/item/skeleton_spawn_egg.png", "usage": "TEMPORARY_UNIT_ICON" },
    { "cardId": "cd_004", "artKey": "card_art.cd_004", "sourcePath": "assets/minecraft/textures/block/sculk_sensor_top.png", "usage": "TEMPORARY_BLOCK_MOTIF" },
    { "cardId": "cd_005", "artKey": "card_art.cd_005", "sourcePath": "assets/minecraft/textures/item/vindicator_spawn_egg.png", "usage": "TEMPORARY_UNIT_ICON" },
    { "cardId": "cd_006", "artKey": "card_art.cd_006", "sourcePath": "assets/minecraft/textures/block/sculk_catalyst_top.png", "usage": "TEMPORARY_BLOCK_MOTIF" },
    { "cardId": "cd_007", "artKey": "card_art.cd_007", "sourcePath": "assets/minecraft/textures/item/chest_minecart.png", "usage": "TEMPORARY_ITEM_ICON" },
    { "cardId": "cd_008", "artKey": "card_art.cd_008", "sourcePath": "assets/minecraft/textures/block/dark_oak_planks.png", "usage": "TEMPORARY_BLOCK_MOTIF" },

    { "cardId": "or_001", "artKey": "card_art.or_001", "sourcePath": "assets/minecraft/textures/item/salmon.png", "usage": "TEMPORARY_ITEM_ICON" },
    { "cardId": "or_002", "artKey": "card_art.or_002", "sourcePath": "assets/minecraft/textures/item/dolphin_spawn_egg.png", "usage": "TEMPORARY_UNIT_ICON" },
    { "cardId": "or_003", "artKey": "card_art.or_003", "sourcePath": "assets/minecraft/textures/item/drowned_spawn_egg.png", "usage": "TEMPORARY_UNIT_ICON" },
    { "cardId": "or_004", "artKey": "card_art.or_004", "sourcePath": "assets/minecraft/textures/item/guardian_spawn_egg.png", "usage": "TEMPORARY_UNIT_ICON" },
    { "cardId": "or_005", "artKey": "card_art.or_005", "sourcePath": "assets/minecraft/textures/item/turtle_spawn_egg.png", "usage": "TEMPORARY_UNIT_ICON" },
    { "cardId": "or_006", "artKey": "card_art.or_006", "sourcePath": "assets/minecraft/textures/item/trident.png", "usage": "TEMPORARY_ITEM_ICON" },
    { "cardId": "or_007", "artKey": "card_art.or_007", "sourcePath": "assets/minecraft/textures/block/tube_coral_block.png", "usage": "TEMPORARY_BLOCK_MOTIF" },
    { "cardId": "or_008", "artKey": "card_art.or_008", "sourcePath": "assets/minecraft/textures/block/prismarine_bricks.png", "usage": "TEMPORARY_BLOCK_MOTIF" },

    { "cardId": "nt_001", "artKey": "card_art.nt_001", "sourcePath": "assets/minecraft/textures/item/magma_cube_spawn_egg.png", "usage": "TEMPORARY_UNIT_ICON" },
    { "cardId": "nt_002", "artKey": "card_art.nt_002", "sourcePath": "assets/minecraft/textures/item/zombified_piglin_spawn_egg.png", "usage": "TEMPORARY_UNIT_ICON" },
    { "cardId": "nt_003", "artKey": "card_art.nt_003", "sourcePath": "assets/minecraft/textures/item/blaze_spawn_egg.png", "usage": "TEMPORARY_UNIT_ICON" },
    { "cardId": "nt_004", "artKey": "card_art.nt_004", "sourcePath": "assets/minecraft/textures/item/strider_spawn_egg.png", "usage": "TEMPORARY_UNIT_ICON" },
    { "cardId": "nt_005", "artKey": "card_art.nt_005", "sourcePath": "assets/minecraft/textures/item/wither_skeleton_spawn_egg.png", "usage": "TEMPORARY_UNIT_ICON" },
    { "cardId": "nt_006", "artKey": "card_art.nt_006", "sourcePath": "assets/minecraft/textures/item/lava_bucket.png", "usage": "TEMPORARY_ITEM_ICON" },
    { "cardId": "nt_007", "artKey": "card_art.nt_007", "sourcePath": "assets/minecraft/textures/block/respawn_anchor_top.png", "usage": "TEMPORARY_BLOCK_MOTIF" },
    { "cardId": "nt_008", "artKey": "card_art.nt_008", "sourcePath": "assets/minecraft/textures/block/nether_bricks.png", "usage": "TEMPORARY_BLOCK_MOTIF" },

    { "cardId": "ed_001", "artKey": "card_art.ed_001", "sourcePath": "assets/minecraft/textures/item/endermite_spawn_egg.png", "usage": "TEMPORARY_UNIT_ICON" },
    { "cardId": "ed_002", "artKey": "card_art.ed_002", "sourcePath": "assets/minecraft/textures/item/chorus_fruit.png", "usage": "TEMPORARY_ITEM_ICON" },
    { "cardId": "ed_003", "artKey": "card_art.ed_003", "sourcePath": "assets/minecraft/textures/item/enderman_spawn_egg.png", "usage": "TEMPORARY_UNIT_ICON" },
    { "cardId": "ed_004", "artKey": "card_art.ed_004", "sourcePath": "assets/minecraft/textures/item/shulker_spawn_egg.png", "usage": "TEMPORARY_UNIT_ICON" },
    { "cardId": "ed_005", "artKey": "card_art.ed_005", "sourcePath": "assets/minecraft/textures/item/ender_pearl.png", "usage": "TEMPORARY_ITEM_ICON" },
    { "cardId": "ed_006", "artKey": "card_art.ed_006", "sourcePath": "assets/minecraft/textures/item/ender_eye.png", "usage": "TEMPORARY_ITEM_ICON" },
    { "cardId": "ed_007", "artKey": "card_art.ed_007", "sourcePath": "assets/minecraft/textures/item/end_crystal.png", "usage": "TEMPORARY_ITEM_ICON" },
    { "cardId": "ed_008", "artKey": "card_art.ed_008", "sourcePath": "assets/minecraft/textures/block/end_portal_frame_top.png", "usage": "TEMPORARY_BLOCK_MOTIF" },

    { "cardId": "tk_001", "artKey": "card_art.tk_001", "sourcePath": "assets/minecraft/textures/block/white_wool.png", "usage": "TEMPORARY_BLOCK_MOTIF" },
    { "cardId": "tk_002", "artKey": "card_art.tk_002", "sourcePath": "assets/minecraft/textures/item/wheat.png", "usage": "TEMPORARY_ITEM_ICON" },
    { "cardId": "tk_003", "artKey": "card_art.tk_003", "sourcePath": "assets/minecraft/textures/item/cow_spawn_egg.png", "usage": "TEMPORARY_UNIT_ICON" },
    { "cardId": "tk_004", "artKey": "card_art.tk_004", "sourcePath": "assets/minecraft/textures/item/fox_spawn_egg.png", "usage": "TEMPORARY_UNIT_ICON" },
    { "cardId": "tk_005", "artKey": "card_art.tk_005", "sourcePath": "assets/minecraft/textures/item/rotten_flesh.png", "usage": "TEMPORARY_ITEM_ICON" },
    { "cardId": "tk_006", "artKey": "card_art.tk_006", "sourcePath": "assets/minecraft/textures/item/brick.png", "usage": "TEMPORARY_ITEM_ICON" },